{
  "artifactVersion": 1,
  "messageGrammarVersion": 1,
  "catalog": "app",
  "locale": "de",
  "contractFingerprint": "sha256:aaaaaaaaaaaaaaaaaaaaaaaaaaaaaaaaaaaaaaaaaaaaaaaaaaaaaaaaaaaaaaaa",
  "messages": {
    "Common.Save": {
      "pattern": "Jetzt speichern",
      "arguments": []
    }
  }
}
